{
  "$schema": "http://json-schema.org/draft-07/schema#",
  "$id": "https://groundwork.build/design-catalog/schema.json",
  "title": "Design Catalog Entry",
  "description": "A curated reference design system the builder can select and tailor to a practice. See SCHEMA.md.",
  "type": "object",
  "additionalProperties": false,
  "required": ["schemaVersion", "id", "name", "tag", "selection", "tokens", "layout", "imagery", "voice", "fidelity", "audit"],
  "properties": {
    "schemaVersion": { "const": "1.2" },
    "id": { "type": "string", "pattern": "^[a-z0-9]+(-[a-z0-9]+)*$", "description": "kebab-case, unique = catalog key" },
    "name": { "type": "string" },
    "tag": { "const": "reference" },

    "source": {
      "type": "object",
      "additionalProperties": false,
      "properties": {
        "url": { "type": "string" },
        "screenshot": { "type": "string" },
        "ingestedVia": { "type": "string", "enum": ["claude-design", "custom-ingest", "manual"] },
        "captured": { "type": "string" }
      }
    },

    "selection": {
      "type": "object",
      "additionalProperties": false,
      "required": ["archetype", "moods", "adjectives"],
      "properties": {
        "archetype": {
          "type": "string",
          "enum": ["editorial-asymmetric", "magazine-split", "poster-hero", "bold-serif-driven", "minimal-brutalist", "centered-classic", "warm-editorial", "card-heavy"],
          "description": "NEAREST existing archetype label — keeps sampleLibrary/ai-director back-compatible. Not the source of layout."
        },
        "moods": {
          "type": "array",
          "items": { "type": "string", "enum": ["warm-neighborhood", "modern-premium", "clean-clinical", "soft-gentle"] },
          "minItems": 1
        },
        "adjectives": { "type": "array", "items": { "type": "string" }, "minItems": 1 },
        "bestFor": { "type": "string" },
        "verticalBias": { "type": "array", "items": { "type": "string" } },
        "appetite": {
          "type": "object",
          "description": "How much of each content signal this template wants (1=light, 2=helpful, 3=signature). Soft match for --reference auto; builder still degrades when scrape is thin.",
          "additionalProperties": false,
          "required": ["photography", "statistics", "socialProof", "team", "copy"],
          "properties": {
            "photography": { "type": "integer", "minimum": 1, "maximum": 3 },
            "statistics": { "type": "integer", "minimum": 1, "maximum": 3 },
            "socialProof": { "type": "integer", "minimum": 1, "maximum": 3 },
            "team": { "type": "integer", "minimum": 1, "maximum": 3 },
            "copy": { "type": "integer", "minimum": 1, "maximum": 3 }
          }
        }
      }
    },

    "tokens": {
      "type": "object",
      "additionalProperties": false,
      "required": ["color", "type", "shape", "elevation", "border", "button", "label", "density", "motion"],
      "properties": {
        "color": {
          "type": "object",
          "additionalProperties": false,
          "required": ["strategy"],
          "properties": {
            "strategy": {
              "type": "object",
              "additionalProperties": false,
              "required": ["theme", "contrast", "saturation", "accentUsage"],
              "description": "REMAPPABLE — applied to the practice's own elevated hues.",
              "properties": {
                "theme": { "type": "string", "enum": ["light", "dark"] },
                "background": { "type": "string" },
                "contrast": { "type": "string", "enum": ["low", "medium", "medium-high", "high"] },
                "saturation": { "type": "string", "enum": ["muted", "moderate", "vivid"] },
                "accentUsage": { "type": "string", "enum": ["sparing", "moderate", "prominent"] },
                "surfaceStrategy": { "type": "string" }
              }
            },
            "reference": {
              "type": "object",
              "description": "The SOURCE's literal hexes — for the gallery + as a sanity anchor. NOT shipped verbatim.",
              "additionalProperties": { "type": "string" }
            }
          }
        },
        "type": {
          "type": "object",
          "additionalProperties": false,
          "required": ["classification", "pairing", "heading", "body", "scale"],
          "properties": {
            "classification": {
              "type": "string",
              "enum": ["editorial-serif", "display-serif", "humanist-trust", "modern-grotesque", "geometric-clean"],
              "description": "De-branding: classify, don't name. Resolves to the builder's font-pairing buckets so any practice gets a real, license-clean pairing. The literal source font belongs in reference, never here."
            },
            "substitutionCriteria": {
              "type": "string",
              "description": "What a substitute font must preserve to keep the reference's feel (e.g. 'tight tracking, tall x-height, light display weights available')."
            },
            "pairing": { "type": "string" },
            "heading": { "type": "object" },
            "body": { "type": "object" },
            "scale": { "type": "string", "enum": ["compact", "standard", "editorial"] },
            "headingScale": { "type": "string", "enum": ["sm", "md", "lg", "xl"] },
            "contrast": { "type": "string", "enum": ["low", "medium", "high"] },
            "reference": {
              "type": "object",
              "description": "The SOURCE's literal font names — preview/anchor only, never shipped.",
              "additionalProperties": { "type": "string" }
            }
          }
        },
        "shape": {
          "type": "object",
          "additionalProperties": false,
          "required": ["cornerRadius"],
          "properties": { "cornerRadius": { "type": "string", "enum": ["sharp", "sm", "md", "lg", "pill"] } }
        },
        "elevation": {
          "type": "object",
          "additionalProperties": false,
          "required": ["system"],
          "properties": { "system": { "type": "string", "enum": ["flat", "soft-shadow", "layered"] } }
        },
        "border": {
          "type": "object",
          "additionalProperties": false,
          "required": ["treatment"],
          "properties": { "treatment": { "type": "string", "enum": ["hairline", "standard", "none"] } }
        },
        "button": {
          "type": "object",
          "additionalProperties": false,
          "required": ["treatment"],
          "description": "Component-atom tokens — consumed by derive-design-tokens.js (buttonTreatment).",
          "properties": {
            "treatment": { "type": "string", "enum": ["filled", "outline", "soft-fill"] },
            "character": { "type": "string", "description": "prose the enum can't carry, e.g. 'pill-radius filled primary + ghost secondary; generous x-padding'" }
          }
        },
        "label": {
          "type": "object",
          "additionalProperties": false,
          "required": ["style"],
          "description": "Section label/eyebrow atom — consumed by derive-design-tokens.js (labelStyle).",
          "properties": {
            "style": { "type": "string", "enum": ["badge", "inline"] },
            "character": { "type": "string", "description": "e.g. 'soft tonal pill chips with icon' or 'plain small-caps inline'" }
          }
        },
        "density": { "type": "string", "enum": ["airy", "balanced", "dense"] },
        "motion": { "type": "string", "enum": ["none", "subtle", "expressive"] }
      }
    },

    "layout": {
      "type": "object",
      "additionalProperties": false,
      "required": ["sections", "variants", "composition"],
      "properties": {
        "sections": { "type": "array", "items": { "type": "string" }, "minItems": 1 },
        "variants": {
          "type": "object",
          "additionalProperties": false,
          "description": "Each value MUST be an existing on-disk component (Phase A renderable). ALL nine picks are required — the builder renders chrome (nav/footer) and every core section for every site; an unspecified pick would silently fall back to a default and lose the reference's character.",
          "required": ["heroLayout", "servicesLayout", "aboutLayout", "testimonialsLayout", "ctaLayout", "faqLayout", "navVariant", "footerVariant", "galleryVariant"],
          "properties": {
            "heroLayout": { "enum": ["centered", "poster", "split-offset", "split", "text-only"] },
            "servicesLayout": { "enum": ["accordion", "alternating-rows", "card-grid", "numbered-list", "two-col-feature"] },
            "aboutLayout": { "enum": ["editorial-full", "full-width-card", "minimal-text", "split-photo", "two-col-brief"] },
            "testimonialsLayout": { "enum": ["card-row", "grid-mosaic", "list-testimonials", "pull-quotes", "single-featured"] },
            "ctaLayout": { "enum": ["centered-banner", "floating-card", "inline-minimal", "split-image", "two-button"] },
            "faqLayout": { "enum": ["accordion-expandable", "cards-grid", "simple-stack", "split-by-category", "two-column"] },
            "navVariant": { "enum": ["centered-logo", "split-logo", "transparent-overlay", "left-logo", "top-bar"] },
            "footerVariant": { "enum": ["minimal-dark", "editorial-split", "classic-4col", "bold-cta-footer"] },
            "galleryVariant": { "enum": ["editorial-2col", "full-bleed-row", "filmstrip", "masonry-3col", "featured-grid"] }
          }
        },
        "composition": {
          "type": "object",
          "description": "Per-section prose that the variant pick cannot encode (hero anatomy, floating elements, etc.). hero, nav, and footer entries are REQUIRED — chrome is where generic defaults sneak back in.",
          "required": ["hero", "nav", "footer"],
          "properties": {
            "hero": { "type": "string" },
            "nav": { "type": "string" },
            "footer": { "type": "string" }
          },
          "additionalProperties": { "type": "string" }
        },
        "novel": {
          "type": "array",
          "description": "PHASE B — section designs NOT expressible by any existing variant.",
          "items": {
            "type": "object",
            "additionalProperties": false,
            "required": ["section", "name", "spec", "requiresNewComponent"],
            "properties": {
              "section": { "type": "string" },
              "name": { "type": "string" },
              "spec": { "type": "string" },
              "requiresNewComponent": { "type": "boolean" }
            }
          }
        }
      }
    },

    "imagery": {
      "type": "object",
      "additionalProperties": false,
      "required": ["grading", "subjectTreatment"],
      "description": "Image treatment RECIPE — transfers; the actual photos never do. The most brand-agnostic layer: a practice's own photos get this treatment.",
      "properties": {
        "crop": { "type": "string", "description": "e.g. 'tight subject crops, generous headroom, rounded-lg containers'" },
        "grading": { "type": "string", "description": "color grading, e.g. 'warm, slightly desaturated, lifted blacks'" },
        "framing": { "type": "string", "description": "e.g. 'subjects offset right, environmental context kept'" },
        "subjectTreatment": { "type": "string", "description": "e.g. 'candid documentary, never posed-clinical; one human focal subject per image'" },
        "imageTextRatio": { "type": "string", "enum": ["image-dominant", "balanced", "text-dominant"] }
      }
    },

    "voice": {
      "type": "object",
      "additionalProperties": false,
      "required": ["formality", "rhythm"],
      "description": "Tone system — transfers; the source's actual copy never does. Steers content generation (and can feed copy tooling).",
      "properties": {
        "formality": { "type": "string", "enum": ["casual", "conversational", "professional", "formal"] },
        "rhythm": { "type": "string", "description": "sentence rhythm, e.g. 'short declaratives; one-line paragraphs; headline carries one emphasized phrase'" },
        "favors": { "type": "array", "items": { "type": "string" }, "description": "vocabulary kinds to lean into, e.g. 'sensory comfort words', 'plain-spoken verbs'" },
        "avoids": { "type": "array", "items": { "type": "string" }, "description": "vocabulary kinds to ban, e.g. 'clinical jargon', 'filler superlatives'" }
      }
    },

    "fidelity": {
      "type": "object",
      "additionalProperties": false,
      "required": ["layout", "theme", "phase"],
      "description": "Two independent axes (revealed by the dark-reference pressure test): does the LAYOUT map to existing variants, AND can the RENDERER produce the look (theme/tokens).",
      "properties": {
        "layout": { "type": "string", "enum": ["full", "partial", "none"], "description": "do sections map to existing variant components?" },
        "theme": { "type": "string", "enum": ["light-native", "needs-dark-support", "needs-token-extension"], "description": "can the current renderer/token system produce this look?" },
        "phase": { "type": "string", "enum": ["A", "B"], "description": "A = ships on current capabilities; B = needs a new capability (variant, theme, or token)" },
        "gaps": {
          "type": "array",
          "items": {
            "type": "object",
            "additionalProperties": false,
            "required": ["type", "detail"],
            "properties": {
              "type": { "type": "string", "enum": ["variant", "theme", "token"] },
              "detail": { "type": "string" }
            }
          }
        }
      }
    },

    "audit": {
      "type": "object",
      "additionalProperties": false,
      "required": ["sanctionedPatterns", "fidelityChecks"],
      "properties": {
        "sanctionedPatterns": {
          "type": "array",
          "description": "Taste-bans this reference legitimately uses → critique suppresses them for ITS builds. Enum is the 10 suppressible taste ids ONLY; correctness bans cannot be named here. NOTE: a sanctioned pattern that implies a rendering capability (gradient-accent → gradient token; pure-black → dark theme) MUST also appear in fidelity.gaps if that capability is not yet built.",
          "items": {
            "type": "string",
            "enum": ["pure-black", "inter-display", "centered-over-dark-hero", "three-equal-cards", "gradient-accent", "emoji-in-content", "nested-cards", "icon-tile-above-heading", "eyebrow-above-heading", "side-accent-border", "gray-glow-shadow"]
          }
        },
        "fidelityChecks": {
          "type": "array",
          "description": "Positive, reference-specific pass/fail gates appended to the critique rubric for this build.",
          "items": { "type": "string" }
        }
      }
    }
  }
}
